{
  "$schema": "http://json-schema.org/draft-07/schema#",
  "title": "Security Posture Findings",
  "type": "array",
  "items": {
    "type": "object",
    "required": [
      "timestamp",
      "type",
      "target",
      "severity",
      "status"
    ],
    "properties": {
      "timestamp": {
        "type": "string",
        "format": "date-time"
      },
      "type": {
        "type": "string",
        "enum": [
          "secret",
          "dep",
          "perm",
          "waf",
          "dns",
          "mx",
          "redirect",
          "blob",
          "htaccess",
          "policy"
        ]
      },
      "target": {
        "type": "string"
      },
      "severity": {
        "type": "string",
        "enum": [
          "low",
          "medium",
          "high",
          "critical"
        ]
      },
      "evidence": {
        "type": "string"
      },
      "recommended_fix": {
        "type": "string"
      },
      "owner": {
        "type": "string"
      },
      "status": {
        "type": "string",
        "enum": [
          "open",
          "mitigating",
          "resolved",
          "ignored"
        ]
      }
    }
  }
}