[
  {
    "timestamp": "2025-08-09T23:40:32.571656+00:00",
    "type": "secret",
    "target": "/private/.env",
    "severity": "high",
    "evidence": "Patrón API_KEY=",
    "recommended_fix": "Mover a secret manager y rotar",
    "owner": "security-team",
    "status": "open"
  },
  {
    "timestamp": "2025-08-09T23:40:32.571656+00:00",
    "type": "htaccess",
    "target": "/public/.htaccess",
    "severity": "medium",
    "evidence": "Reglas de reescritura/redirect detectadas",
    "recommended_fix": "Simplificar y validar loops",
    "owner": "web-team",
    "status": "mitigating"
  },
  {
    "timestamp": "2025-08-09T23:40:32.571656+00:00",
    "type": "dns",
    "target": "qma.mx",
    "severity": "low",
    "evidence": "MX válido",
    "recommended_fix": "Monitoreo semanal",
    "owner": "infra-team",
    "status": "resolved"
  }
]